{
  "contract_version": "asi.evaluation/v0.3",
  "name": "research-contract",
  "revision": 1,
  "task_class": "research.compare",
  "owner": "fixture-owner-not-production-authority",
  "authority_mode": "fixture",
  "criteria": [
    {
      "id": "sources",
      "evaluator": "eval.is_true@1",
      "target": {
        "node": "source_check",
        "port": "passed"
      },
      "required": true,
      "decision_kind": "deterministic",
      "arguments": {},
      "evidence_requirement": "checker_result",
      "decision_policy_ref": null
    },
    {
      "id": "claim_support",
      "evaluator": "eval.citation_support@1",
      "target": {
        "node": "synthesize",
        "port": "report"
      },
      "required": true,
      "decision_kind": "probability",
      "arguments": {},
      "evidence_requirement": "source_evidence",
      "decision_policy_ref": null
    }
  ],
  "learned_acceptance": "disabled",
  "repair": {
    "max_rounds": 1,
    "allowed_nodes": [
      "synthesize"
    ]
  }
}
